{
  "$schema": "./config.schema.json",
  "version": "1.0.0",
  "metadata": {
    "created": "2025-07-26T00:00:00+09:00",
    "modified": "2025-07-26T00:00:00+09:00",
    "modifiedBy": "system",
    "revision": 1
  },
  "hostdomains": {
    "lacisstack.ath.cx": "192.168.234.0/24",
    "example.com": "192.168.123.0/24"
  },
  "hostingdevice": {
    "lacisstack.ath.cx": {
      "": {
        "deviceip": "",
        "port": [],
        "sitename": "",
        "ips": []
      },
      "/board": {
        "deviceip": "192.168.234.10",
        "port": [8080, 8443],
        "sitename": "whiteboard",
        "ips": ["any"]
      },
      "/app": {
        "deviceip": "192.168.234.20",
        "port": [3000],
        "sitename": "webapp",
        "ips": ["192.168.1.0/24", "10.0.0.0/8"]
      }
    },
    "example.com": {
      "": {
        "deviceip": "192.168.123.10",
        "port": [80],
        "sitename": "example-root",
        "ips": ["any"]
      }
    }
  },
  "adminuser": {
    "lacisadmin": "$argon2id$v=19$m=65536,t=3,p=4$c29tZXNhbHQ$RdescudvJCsgt3ub+b+dWRWJTmaaJObG"
  },
  "endpoint": {
    "logserver": "https://logs.example.com/api/v1/logs"
  },
  "options": {
    "websocket_timeout": 600,
    "log_retention_days": 30,
    "session_timeout": 86400,
    "max_request_size": 10485760,
    "rate_limit": {
      "requests_per_minute": 60,
      "burst": 120
    }
  }
} 